{
  "id": "anti-ai-flavor",
  "name": "Anti-AI-Flavor / 去 AI 味",
  "description": "按中英文会话语言注入可配置的叙事文风约束。",
  "maintainer": "community",
  "author": "charlesli1989",
  "repository": "https://github.com/charlesli1989/anti-ai-flavor",
  "path": "",
  "ref": "main",
  "category": "narrative",
  "locales": [
    "zh-CN",
    "en-US"
  ],
  "license": null,
  "covelVersion": null,
  "status": "pending",
  "demo": null,
  "notes": "来源：ackness/covel#81。作者已同意目录收录；许可证和适配版本待作者确认，暂不列为可安装推荐。未复制或重新许可上游代码。"
}
