{
  "id": "notes-workbench",
  "name": "Notes Workbench Example",
  "description": "A notes panel that discovers independent formatter services and saves results after successful processing.",
  "maintainer": "official",
  "author": "covel-ai",
  "repository": "https://github.com/covel-ai/covel-plugins",
  "path": "examples/notes-workbench",
  "ref": "main",
  "category": "authoring",
  "locales": ["zh-CN", "en-US"],
  "license": "MIT",
  "covelVersion": "0.0.50",
  "status": "active",
  "demo": "https://github.com/covel-ai/covel-plugins/blob/main/examples/notes-workbench/README.md",
  "notes": "Official composable-notes example: manual runtimes, services and an HTML panel. Works alone for raw notes; formatters need version 2.0.0 or later.",
  "translations": {
    "zh-CN": {
      "name": "记录工作台示例",
      "description": "记录面板发现独立格式化服务，处理成功后保存结果。",
      "notes": "官方组合记录示例：手动 runtime、服务与 HTML 面板。可单独安装用于原样保存；格式化插件须为 2.0.0 及以上。"
    }
  }
}
