{
  "id": "note-format-outline",
  "name": "Outline Note Example",
  "description": "Entry-only note formatter that turns nonblank lines into a plain-text bullet list.",
  "maintainer": "official",
  "author": "covel-ai",
  "repository": "https://github.com/covel-ai/covel-plugins",
  "path": "examples/note-format-outline",
  "ref": "main",
  "category": "authoring",
  "locales": ["zh-CN", "en-US"],
  "license": "MIT",
  "covelVersion": "0.0.50",
  "status": "active",
  "demo": "https://github.com/covel-ai/covel-plugins/blob/main/examples/note-format-outline/README.md",
  "notes": "Official composable-notes example. Provides the examples.note-format@1 service; version 2.0.0 requires Notes Workbench 2.0.0 or later. Install independently and approve server code per session.",
  "translations": {
    "zh-CN": {
      "name": "笔记大纲示例",
      "description": "纯 entry 格式化服务：将非空行整理成纯文本项目符号列表。",
      "notes": "官方组合记录示例，提供 examples.note-format@1 服务；2.0.0 须与记录工作台 2.0.0 及以上配合。须单独安装并在会话中授权服务端代码。"
    }
  }
}
