{
  "id": "openai-image-gen",
  "name": "OpenAI Images",
  "description": "Generates story illustrations through the OpenAI-compatible image pipeline and displays a gallery.",
  "maintainer": "official",
  "author": "covel-ai",
  "repository": "https://github.com/covel-ai/covel-plugins",
  "path": "plugins/openai-image-gen",
  "ref": "main",
  "category": "media",
  "locales": ["zh-CN", "en-US"],
  "license": "MIT",
  "covelVersion": "0.0.50",
  "status": "active",
  "demo": "https://github.com/covel-ai/covel-plugins/blob/main/plugins/openai-image-gen/README.md",
  "notes": "Official optional plugin moved from the Covel main repository. Restart and grant session code approval after installation. Requires a configured model role. Only one illustration flow (DashScope or OpenAI Images) can be active in a session.",
  "translations": {
    "zh-CN": {
      "name": "OpenAI 兼容剧情生图",
      "description": "通过 OpenAI 兼容图像管线生成剧情插图并展示画廊。",
      "notes": "从 Covel 主仓迁移的官方可选插件；安装后重启并在会话中授权。需要配置对应模型用途。同一会话只能启用一个插图流程（DashScope 或 OpenAI 图片二选一）。"
    }
  }
}
